Name,Address,Email,Text,Phone Number,Country
Stephen Brady,"11154 Mark Drive Apt. 413East Deborah, UT 71717",angelreed@example.net,Provide bar sit hot camera show. Bit late TV message. Television gas write worry world himself girl.Respond act six information from.,451-675-8932x47765,Gambia
Dylan Osborne,"960 Gregory Corner Apt. 071Anthonyville, SD 19867",daniellemadden@example.com,Individual star enjoy sign future white film. Carry eight traditional respond mind assume performance.Such nearly produce physical shake.,001-494-322-6413x55113,Lesotho
Benjamin Chavez,"399 Laura Drives Suite 233Stephaniehaven, MD 80530",gunderwood@example.com,Always executive two. Hit that another now such. Local camera respond fire walk anything position.,235.526.9309x616,Moldova
Crystal Miller,"811 Castro FlatPort Karen, DE 51679",greynolds@example.org,Phone treat carry road chair account section. Out nothing minute once who picture nice. Start trip but floor hot.,371-524-3088,Guatemala
Crystal Diaz,"59642 Clark Viaduct Suite 426New Brandonside, NV 48129",jill50@example.com,During computer toward instead occur hospital. Account local remain some raise. Firm defense game interest reality successful certainly project.,(654)755-1170x487,Oman
Keith West II,"51915 Walker Terrace Suite 135Fisherburgh, NC 73459",anthonyfred@example.org,Ball take significant left fear available. Image receive friend play.Stage assume them really office design. Drop take dinner student. Small bar candidate remain discussion.,585.728.2300x9477,Netherlands
David Ramirez,"716 Guerrero RapidNorth Saraland, TN 27041",sergio90@example.com,Decide face wide after effort fast. After rise next avoid. To believe imagine road safe the.Condition professional ten do figure. Cell issue company home leg worry bar.,+1-578-911-7160x59986,Congo
Ethan Weaver,"387 Wanda UnderpassNew Allisonton, AS 12807",lawrence54@example.net,Agency long statement with per knowledge material. Method arrive shoulder measure cell. Detail president fine suggest.Her authority turn get myself. Market apply without team list.,982-453-9424,Portugal
Sara Clark,Unit 3974 Box 6084DPO AE 11704,shane57@example.com,Whose use little study. Write deep hand race building really.Others notice pay animal age image. Around politics fish with. Center bank most however start.,341.412.3266x403,Nigeria
Paul Gross,"532 Rhonda Branch Suite 666West Daniel, RI 62931",susan50@example.com,Hotel want write stop laugh year. Face interesting letter audience official dinner. Cell stay win culture.Good message raise card deep. Position story deep section ability. Particularly ten people.,901.976.6949,Cyprus
Tammy Garcia PhD,"PSC 8370, Box 2084APO AP 21034",agarcia@example.net,Radio store many together social staff among tend. Change car trouble quickly effort out smile reveal. While factor in movement.,207.491.7895x60495,Greece
Ashley Santana,"932 Miller DrivePort Susanville, FL 07278",scottsamantha@example.com,Head our indeed often. Head around for at simply assume. Evening pick return. Upon business here west.Baby team news room. Federal each term report foot skill reflect risk.,+1-612-812-7296x60564,Timor-Leste
Heather Rodriguez,"1583 Katie WalkNorth Allenmouth, MA 21058",vanessaparker@example.org,Drop central near floor deep.Near natural drop soon often respond. Strategy manage phone. Even try understand news.,(309)757-3255,Saint Lucia
Krista Wheeler,"38959 Wright Rest Suite 169Greenfort, NE 47675",kimberly27@example.net,Building difficult fast yes other watch. Not history financial should letter air. Investment fear assume site recent.,232.612.6576x81548,Somalia
Zachary Jones,Unit 4285 Box 2573DPO AP 74230,zacharybrown@example.org,Section speak kitchen city energy. Democrat ground way road.,+1-754-637-8509,Christmas Island
Mrs. Brandi Palmer DVM,"361 Matthew KeysLisaland, ME 27688",potterkathleen@example.net,Beat add deep fly doctor industry individual. Wide agency race.Board south fight success him. Sport trip big us.Official card court blood western lot. Anything trial wrong no miss.,001-527-569-5989x90120,Saint Kitts and Nevis
Alfred King,"6125 Laura PointNorth Brianaberg, NV 21239",steventhomas@example.org,State wide down instead business tax themselves. Operation she get writer nation goal traditional. Probably while face another rock. Cut process now girl various grow.,206.578.5093x7665,Kiribati
James Brown,"66106 Anthony Rapids Apt. 459Seanshire, NE 12346",amandacooper@example.org,Her keep allow know specific low level. Kitchen leave cause sure newspaper claim interesting site. Station high according development finish national on.Baby might forget generation establish ten.,256-603-5538,Bahrain
Lisa Williams,"119 Elizabeth Fort Apt. 281Lake Melissa, PR 84947",rachelevans@example.com,Current without experience north team theory yeah. Rate religious before democratic.Small oil few thank. Movie sure agency. North painting message expert.,3673955306,Lao People's Democratic Republic
Christopher Villa,"85150 Dakota MountainWest Gary, CT 55973",ronaldtyler@example.net,Especially upon use every.Month pass owner interest story. Bag blood itself ten song traditional.Decade scene production present. Do beyond prove.,(634)550-6100,Libyan Arab Jamahiriya
Chad Melendez,"3396 Julie OverpassNorth Ian, VA 72867",courtneyjohnson@example.org,Administration think effort later worker artist leave. Hope clear night. Major main break mother heart store standard.,530-321-7313x24973,Gibraltar
Courtney Vargas,"972 Bryan Cape Apt. 144South Cynthialand, CA 46426",jonescameron@example.com,Citizen finish reduce produce she medical control. Box century your better try center bank.,831.472.7222x92048,Vanuatu
Tanya Santos,"3273 Lauren MewsBreannafort, IL 86622",anna18@example.net,Cup toward wind difficult project environmental skill. Cost knowledge year return sure her raise fund. Leader something letter high offer Democrat why.,001-868-432-1297x520,Thailand
Hannah Nguyen,"1581 Juan PlaceWest Brian, MD 56028",mclaughlinemily@example.net,Ready fill show once. Environment within on protect. Enough allow claim.,744-886-7526,Haiti
Megan Todd,"78545 Foster Crossing Suite 060Danielton, NV 05165",hernandezadam@example.net,Situation probably room identify notice sit home. Man majority no good former imagine. Couple type camera us.,001-431-880-6085x749,France
Cheryl Morris,Unit 6635 Box 9220DPO AE 63663,ballardnathan@example.net,Policy which foreign wrong series mouth personal.Half drive worry whom. Benefit eight memory response respond clearly else.,230.539.1666x25936,Bahamas
Jordan Marquez,"2657 Ramirez FlatLake Kaitlyn, TX 54163",morrisdonald@example.net,Window street speech economy. Form product issue material popular range require.,(820)439-3794x186,United States of America
Danielle Rodriguez,"07686 Campos WaysWest Terri, NM 49572",brandy69@example.com,Shake above believe either realize general now. Country effort election again describe tax impact. Physical wall treat nothing language American meet.,+1-622-344-5639x8725,Guadeloupe
Jacqueline Collins,"PSC 8044, Box 9260APO AE 51161",hrose@example.com,Step increase agreement page series. Bad hold whom senior others into administration summer. Across easy decision nation top within team. Military trouble newspaper record common statement.,882.885.3860x83722,Lithuania
Katie Jimenez,"9196 Patricia Cove Apt. 792Port Sean, KS 56126",dhayes@example.net,Have send we door last will.Success hotel cover purpose turn contain personal. Customer attack mother forward half.Focus audience appear. Television environment case buy.,803-305-8772x66768,Bangladesh
Michael Stewart,"58917 Nelson Camp Apt. 874North Roseland, PR 54218",yalvarez@example.org,Baby professional law my apply shake difficult. Radio respond brother several treat.,458-844-9926x84442,Angola
Joseph Simpson,"51041 Davis Spurs Suite 634East Carl, CA 58849",goldenpatricia@example.com,Radio speak inside just. Place body hair bed look party. Future give gun.Talk another direction article chance major star. Young first expect rest technology authority idea why.,(548)502-6035x49569,Honduras
Sarah Wilson,"93799 Williams View Suite 441East Tammy, SD 13860",christianpotts@example.com,Against play daughter western within chair keep.Since your wait minute describe sort behavior. Pattern also window score happen throughout rock. Wall attack skin into.,882-843-6758x597,Jersey
Wendy Mcdonald,"36107 Rush PointKellyland, MH 95601",valdezchristina@example.org,Mind quality south son tonight father voice.Production program pattern wonder level. Impact fear professor score but.East claim apply deal. Including strategy mouth nation avoid.,001-939-626-6585,Reunion
James Keller,"491 Samuel LodgeSouth Gregoryfort, CT 46168",darrell65@example.org,Light out Republican area store resource middle. Easy describe choose leave. Professor scientist watch explain practice whom here. Key specific mention federal risk.,3399687059,Palau
Kelly Williams,"21000 Molly Key Apt. 405Cardenasside, OR 51427",omar08@example.net,Society data remain others never. Next same his follow easy television.,334-325-8219,Norway
Margaret Riley,"936 Robbins Shore Apt. 454Port Charles, UT 63764",jenna61@example.org,Also hotel start describe support business. Agree happy simply become last however rise. Exactly pull how sea address foreign.,7583087210,Saint Vincent and the Grenadines
Chad Hernandez,"37302 Campbell LodgeAmandahaven, ME 10600",patrick91@example.net,Poor this no test. Whose out everybody check which. Popular fight Mrs movie.,(908)571-9756,Portugal
Bonnie Castillo,"3009 Anthony Viaduct Apt. 644Edwardborough, MH 64197",angelvaughan@example.net,Generation candidate together health rich more deal. Camera job opportunity. Find onto television.,841-304-4324,Syrian Arab Republic
Jessica Snyder,"42920 Mitchell Inlet Apt. 136South Michelleside, PR 45899",kcollins@example.net,Participant case southern seem. Send area institution maybe about. Inside this fear again middle show.,6777114297,Korea
Michele Turner,"230 Janet Port Suite 074Lake Micheal, WA 29231",lowerychristopher@example.com,Financial agreement vote picture upon respond. But yard indeed stage political back.Wind air million measure people. Question condition at win.,+1-928-641-7604x00439,Sri Lanka
James Pennington,"90406 Julian VistaNorth Robertside, PW 85472",oscar81@example.org,Public party man wall think machine receive time. Budget land certainly cell.Range attack force. Why five practice under billion garden never. Lay trouble simple card foot.,(459)483-5277x2108,Sweden
Brian Andrade,"2877 Justin FallWest George, AR 54250",ecross@example.net,Billion other however civil pick effort low. Reflect success soon century produce. Drug create test down majority before.Skin computer yes analysis wear value such. Enough color above sport.,+1-666-460-6052,Antigua and Barbuda
Shannon Lang,"162 Michael SquaresNew Jessicaport, UT 07529",santanaamanda@example.net,Carry piece begin. Simply imagine federal admit mention. Condition off behind similar method almost. Size get performance individual apply somebody attack now.,495-706-1604,Western Sahara
Kenneth Wolf,USNS HobbsFPO AA 27652,charles47@example.org,Ok wait price. Sit continue day edge property send responsibility.Plan end modern him offer. Knowledge could sign field me like effect. Point arrive yourself senior young record.,+1-993-403-3899x762,Pitcairn Islands
Tammy Avila,"760 Michelle Skyway Suite 594South Shawn, MH 73261",sheilaclark@example.com,Tend safe property bring defense. Baby then same concern. Theory right available performance art leg become.Artist whom democratic ready while.,(918)244-9149x80825,Brunei Darussalam
Ms. Jill Castillo DVM,"3097 Simmons PortWilliamhaven, WY 61038",cobbcameron@example.org,Wrong despite agree rule like seem consider. Bit experience television me style her. Assume trade across add born size.During federal try control sure front mind. Alone would itself identify.,951.719.6779x286,Brunei Darussalam
James Townsend,"067 Moore Stravenue Apt. 630Steventown, VI 08597",cynthia07@example.org,Would natural direction.Quickly minute leader glass. Continue anything meeting military help. Lay many enjoy ball.I property sort source. Although me ball nearly green land.,+1-718-838-0757,Western Sahara
John Vasquez,"76430 Michael Stream Suite 286Lake Mary, MA 90617",juliamack@example.com,Improve sort between knowledge. The white help meeting.Star young follow should. Memory who issue investment before. Couple memory medical total.,001-411-835-0730x84434,Angola
Nicole Cooke,"138 Devin WayLake David, AL 81881",jeffsantiago@example.com,Several education wonder until interesting clearly.Push garden meet suffer box. Week them company. Laugh night drop week feel card.,974.323.5991,Sudan
Brittany Ferguson,"621 Simmons Road Apt. 411New Davidhaven, NH 09003",shannon44@example.net,For become increase opportunity represent accept add. Customer degree draw foot care as.Hand which beat floor resource miss. Meet probably woman decade doctor front appear try.,886-464-7975,Taiwan
Dean Lee,"3344 Jessica Glen Suite 382North Curtisside, MN 28533",cbradford@example.net,Weight far day nation life year. Congress since near look east avoid blue. Mrs ask catch few no.,001-681-625-9737x8795,Korea
