Name,Address,Email,Text,Phone Number,Country
Jenna Buchanan,"396 David TrailSydneyville, PW 68532",xcunningham@example.org,Create many price watch. Parent office cause marriage recent.Factor treat challenge dog meet door. Interview religious what significant culture modern style.,+1-362-703-3707,Saint Pierre and Miquelon
Gerald Mullen,"3641 Coleman LakesWatkinsfort, ND 52770",summerfigueroa@example.com,Find kind property stay threat agency.Pretty point rest situation physical.Arm rather morning two mother central. Service great power ability better pressure crime. Must live cost something.,860-642-6301x96319,Iceland
Austin Hall,"5988 Jeremiah HavenCastillotown, ID 78698",courtneymorales@example.org,Around continue raise now. Should by expert rock.Say customer degree commercial risk miss challenge. War million present product outside.,(966)504-8431x0989,Korea
Alan Thomas,"380 Myers Summit Apt. 811Gavinshire, VA 14654",kevinroberts@example.com,Bed knowledge worker option major each. Which smile plant different.,+1-337-734-9702x2931,Ecuador
Thomas Collins,USNS MilesFPO AP 05216,walshmargaret@example.org,Trial two we. Eye price former area pick wind scene yourself. Government treatment sister exist individual whom.,3344965782,Cuba
Jessica Randolph,"9919 Robert Squares Apt. 095Lake Ericburgh, ND 99412",ryanyang@example.org,Without perhaps reach style hour. Leader cut according top require. Number simply skin position store much future. Early imagine baby.,001-366-221-7932x7133,Burundi
William Harris,"PSC 8832, Box 5202APO AE 57007",sheamadeline@example.com,Want live itself serve they. Like condition our pretty send region because.Account peace structure produce fact institution paper bad. Why factor hotel I.,(364)837-5085x60114,Lebanon
Christopher Anderson,"8580 Douglas Heights Apt. 864East Melvinland, IL 86961",michael37@example.com,Long particular door prove seem. Fight serious can several have clear their. Usually person act campaign.,776-260-2795x566,Bosnia and Herzegovina
Victoria Roberts,"6515 Gabriela CliffKevinhaven, ME 45843",uweiss@example.net,Mrs quite medical. Rather a student. Consumer network group plan many option research.Hand knowledge note show scientist place several. East act idea senior view finally.,883.718.5890,Barbados
Cindy Page,"781 Elizabeth Valleys Apt. 881Brittanyberg, IL 31615",roblesjamie@example.net,Theory fact woman staff movement seven actually. Make scene station summer financial particular. People thousand benefit describe.,877.398.3331,Svalbard & Jan Mayen Islands
Stephanie Jacobs,Unit 4727 Box 9079DPO AA 62335,kendrapatterson@example.com,Enter provide player box center rest. Way culture think describe owner beat.Need garden others follow step. Summer now watch if.,506.307.7719,El Salvador
Katrina Strickland,"74636 Ronnie Brook Suite 796Jeffersonville, WI 55177",ramosbrittney@example.net,From seat operation employee whatever gun. Others Democrat during success issue small. Strong far not lot.Along hair pay firm. Information kitchen help green student well move.,+1-992-495-6503x85915,Austria
Terrence Mann,Unit 2727 Box 9633DPO AA 43541,allenchristina@example.org,College consider open upon. Might table writer also today trouble wish.,+1-330-297-4418x5851,Equatorial Guinea
Jessica Whitney,"4223 Molina Knolls Apt. 809Nortonfort, DE 12788",ninalawson@example.org,Rise president street level day husband. Congress just forward whether.Artist beautiful inside. Himself break middle wonder. Letter short plan keep since.,+1-235-940-0433,Burundi
Julie Green,"18764 Rowe ExpresswayPort Tammy, FL 47447",nthomas@example.org,Shake discuss notice include business social tax plant. It many magazine great concern. Somebody someone play.Weight sense phone allow.Never need consider appear color.,611-745-1055x4963,Nepal
Brianna Perry,USNS MillerFPO AA 62582,xhill@example.org,Recognize pick head ability budget. Single can commercial sort. Father ahead project.,8154267743,Albania
Ashley Lee,"791 Contreras HillWest Johnny, IN 95824",aschneider@example.org,Same color he cultural meeting they. Herself less marriage charge together travel.Business phone far discuss central paper.,453.201.1148,Mayotte
Sabrina Taylor,"448 Lisa ParkWebbton, LA 76554",jwatkins@example.net,Accept role any particular.Huge goal whole cold community. Line four recognize first. Fund weight explain term.,+1-509-453-9845x80167,Guatemala
Karen Walton,Unit 2596 Box 5818DPO AE 90021,jasmine71@example.com,Student hour court these. Political who yeah.Report audience beautiful agreement evidence political seek than. Accept scientist gas government raise. Because out answer force.,994.709.7978x949,Luxembourg
Sarah Collins,"02163 Ramos Curve Apt. 511Robertburgh, TN 50193",ruben51@example.com,Theory thing peace sense. Amount voice who partner arrive.Later third sing establish. Room success support human. Go different mention fill nothing effort show tax. Social oil east else.,683.337.9123x25016,Bangladesh
Lisa King,"40622 Dawson NeckCainshire, MI 06464",hvasquez@example.net,Organization century me build information sport break. Itself minute prepare affect few voice. Development range ability write break.Still school simple reach. City anyone sit box must.,8689870968,Sudan
Whitney Green,"62208 Zavala VillagesHernandezstad, GU 35230",dmendez@example.com,South as produce degree. Option mean large recognize individual level.Education begin least gun his. Investment quality certain may heart they medical. Dream difficult side time beyond officer.,387.336.5239x06559,Malta
Richard Rios,"9924 Eugene LocksSouth Jesuschester, CO 50415",averymichael@example.net,Near determine lead matter particular writer. Occur national building too. Worker threat same contain give he company.Field kitchen maybe treatment. Keep democratic loss find world discover.,+1-255-507-9810,Chile
Lori Durham,"0802 Schultz TunnelLake Stephanie, TX 85117",beckyhernandez@example.com,Life five price large head though. Point note real game real.Same week number TV people executive low. Hold who policy color might face. Special expert child rest different.,337-428-6837x5207,Gambia
Jamie Larson,"3612 Kimberly Highway Suite 358Oliverton, PW 98857",damongilmore@example.net,Describe where action evidence poor blue. That cultural must near difficult purpose.,439-448-2612x751,United States of America
Pamela Flynn,"216 Adams ForgesEmilyview, HI 10926",jessica13@example.net,Course suggest wall design watch cut rock. From there down. Me so dinner science total.Drug its trip as. Space class difficult kid game national human.,209.674.0540x558,Latvia
Stephanie Adams,Unit 3449 Box 9475DPO AP 66403,joshua17@example.net,Until consider choose street full door box.Dream decide other town wall agent look. What decade hair through magazine realize.,(813)309-3150x28254,Reunion
Charles Pena,"455 Todd GreensJulialand, CA 59872",justinbowen@example.org,Choose cultural open girl current large. Difference simply few individual center development loss. Claim them account organization authority.,7602853537,Denmark
Kayla Hayes,"7279 Anthony Crossing Suite 043New Douglas, VA 23032",kbradshaw@example.net,Prepare way sort right professional small general environmental. Wife person down team sort.Brother door glass despite majority.,(507)729-7648,Australia
Joshua Jensen,"450 Priscilla CrossroadWalkerfort, ND 84713",jonathan72@example.org,Smile bag ball rock player. Ask hear foot available. Tell listen mind not.Information tree left magazine unit likely. Trouble ok lawyer develop that.Worker bank before along land five win.,800.325.2845,Indonesia
Susan Walker,"820 Norris Parks Suite 869East Lauraberg, NJ 14119",gregorytorres@example.org,International year grow nothing. She difficult without rule body goal within develop. Identify do camera whole environmental. Hear state sense view campaign among.,+1-676-617-6633x3329,Gabon
Tammy Padilla,"496 Prince ManorsAmbermouth, NE 63875",fwelch@example.org,Effort event measure career somebody same. Light democratic learn couple. Dinner one people technology boy someone.,001-374-256-4341x5213,Netherlands
John Dunlap,"19917 Chaney ParkwayWilliamland, AZ 31947",jamie02@example.net,Such camera also per identify debate. Treat hotel PM assume. Their produce cut race century.During should every hundred. Boy end available service woman pressure finally.,(267)453-1856x724,Senegal
Calvin Crawford,"7613 Snyder Parkway Suite 478West Wendybury, VI 94381",jacobserin@example.net,Example tend else be. Message gas even see.Back create close material chance police. Far when simple article little ready. Fly college amount prevent opportunity table.,(990)551-2316,Netherlands
Benjamin Alvarez,Unit 5723 Box 2074DPO AP 45311,jeffrey57@example.org,Campaign for catch be certain. Other unit table single full. Tv provide really option form outside system.Admit policy visit positive investment trade. Heart security success chance story spend.,509.242.0973x9030,Cote d'Ivoire
George Rice,"3034 Monica RunAdamsberg, PR 28728",johnsonstephanie@example.com,Yet machine certain own whose. Peace policy though still respond expert.Bar reveal wall most finally school and. Medical receive much voice.,(629)350-2753x8359,India
Jacob Davis,"4028 Santos RoadKelseyton, NH 36810",medinazachary@example.com,World he season. A everything however eye find computer.Easy account month family never. Arm exist administration.,346.254.9208x26883,Tuvalu
Amanda Walters,"687 Bryan Corners Suite 541Port Kendra, DE 12812",brandon17@example.com,Face fear agree risk north suggest discover bar. Late citizen according hear.Month meet none range attack across success. Agree enter trial support ahead trip site peace.,001-367-549-1814,Saint Lucia
Tracy Ramos,"9636 Taylor RampLake Crystalmouth, DC 72731",agonzalez@example.org,Space five far. First major pattern argue not rich child. Mrs other several occur sea remember effect. First play service former paper remain.,211.294.4319,Poland
Nicole Torres,"858 Roberts Neck Suite 408Petersenland, KS 78025",stephenbennett@example.com,Staff begin pressure nor. Range your else real compare. Performance price responsibility only thousand collection window.Perform foreign public mission. Dinner paper yeah seem so turn.,563-429-7727x34812,Marshall Islands
Ruben Rios,"129 West Shore Apt. 467North Maurice, LA 84033",yherrera@example.net,Prepare page work race. Skin week thought church cut.Window force small year young.Protect lawyer around play. Forward challenge nor cold face. Ever executive bed board establish.,488-607-9077x317,Cameroon
Richard White,"0214 Denise Gardens Suite 755Justinland, GU 22362",douglaspatterson@example.org,Decide north financial wear drive book military. Hand represent want consider four important. Break through vote imagine.Main industry degree help study. Six foreign house.,553.848.0531x02855,Pitcairn Islands
Molly Bowers,"3713 John Loop Apt. 285Clarkehaven, AZ 53541",collin76@example.org,North believe process close true late far. Right religious happy bill especially glass.,359.400.7535,Myanmar
Sarah Shelton,"574 Garza PortsPort Dawnside, NH 22571",glopez@example.net,Claim benefit power brother necessary involve.Organization leave room director plan herself. War ago southern which TV work.Understand agree pressure hotel. Eat firm view reveal care work girl.,214.740.4034,China
Bridget Williams,"824 Jeffrey KnollsAlexstad, VT 07256",jamesrivera@example.net,Them music pick network. Area lay teach back history hair. Always lose girl source generation pretty. Wind indicate add town the sell section.,+1-397-361-2588,Saint Kitts and Nevis
Dawn Jones,"PSC 1093, Box 9182APO AA 12530",esmith@example.net,Mr rock card charge. Between once situation trial government matter.Across project experience step ever indicate west long. Option I PM research compare manage in.,668.505.4101,Cambodia
Andrew Reese,"267 Erin ValleysAlexandraside, MP 31685",sotojo@example.org,Drop carry occur build high daughter relationship. Old start girl approach because until follow.Place anyone write authority should player. My gun name themselves decision everybody catch.,543-338-1004x281,United States of America
Brittany Fields,"10404 Moore StreetMichaelfurt, AS 13634",robert93@example.net,Bill rate interest remain guess worker. Produce improve couple compare cost brother himself fear. Positive at medical record capital by today line.Sister enjoy name easy.,+1-292-557-3010x8367,Zimbabwe
Susan Edwards,"093 Lyons Canyon Apt. 850Samanthaberg, IL 26276",jamesmurphy@example.net,Power woman thus article must still. Morning truth become threat clear popular authority condition.Can increase newspaper support. Plant mean force area.,7409447101,Venezuela
James Lane,"5315 Montes Ports Suite 980Patrickstad, OH 56819",sandra15@example.org,Knowledge society test letter ago. Building north also account front. Discussion gun office wear yet might mention somebody. Since step here join model describe impact.,493.419.7894x68752,Seychelles
Kylie Jones,"276 Mccormick CausewaySouth Bonniebury, OH 97626",shahdiane@example.com,Position ok office floor vote we kind law. Generation thank require sell form take.Campaign sell recent official. Back walk keep ground central. Law day ever present.,661-895-9293x12232,Svalbard & Jan Mayen Islands
Jesse Daniels,"8810 Frost Divide Apt. 115Stevenstad, WI 66604",smithsarah@example.net,From same must practice here protect. Leader recent take benefit technology entire end. Receive college black move once sit.Own computer spend be. Director hand system a.,(928)438-7081x2305,India
Ricky Butler,"247 Miller Village Suite 968Jamesburgh, NV 84577",upark@example.net,State past box interest investment. Development family popular who paper very conference. Save foot offer build writer.,001-544-651-1985x3115,Congo
Mackenzie Oliver,"84167 Michelle Fort Suite 005Riveramouth, AR 37587",zharrison@example.net,Born door everybody same upon admit. Allow from certain international skin face. Watch night those can.,+1-961-735-1885x495,Estonia
Laurie Clark,"PSC 6405, Box 1410APO AE 30270",copelandmelissa@example.com,Prepare plant especially short success yeah. Movie on game notice bank.Affect heart sometimes investment. Shoulder discover with film.,(486)325-2550x9734,Iceland
David Thomas III,"45978 Haley ForkRichardsonborough, PR 46058",jeremy12@example.net,Or sister which around friend until. Design capital catch real thousand structure. Environment possible box American increase imagine.I win buy. Similar simply ability much hair spring.,001-314-604-3150x70060,Oman
Debbie Heath,"809 Strickland Isle Suite 343Christophershire, NC 19612",jwilliams@example.com,Student also leg system serve quickly hotel.Make take establish when reflect conference. Agreement force term part total act. Member rather leg continue.,+1-263-252-2803,Vanuatu
Holly Sandoval,"298 Chase Pass Apt. 258North Dominic, ID 70875",kennethelliott@example.com,Woman parent current born threat. Customer will possible possible cold certainly.Past media affect support behind arrive. Whether expect tell ago try attorney. Put blue too ago.,321.972.6924x500,Guinea
Brandon Wilson,"136 Samantha ExtensionsCollinsshire, MI 08984",kelly69@example.org,All account evidence among paper about explain. All writer owner source baby more never free. Result nor up race.Many body manager along standard. Network budget rate throw. Work western drop.,6453356887,Suriname
Jared Morton,"623 Sabrina GardenHarrisborough, MT 20064",whitekyle@example.net,Month nor perhaps dream body Republican institution. Model deep hospital future represent. Seem west may thousand tend include use.,882.262.1286x78297,British Virgin Islands
Laura Clark,"21610 Erica ForgesSouth Jason, FM 10505",amandacarpenter@example.com,Candidate herself science receive same style. Those heavy least stop campaign husband. Own total especially mention front fear.Control scene life challenge toward area argue. Like one detail.,255.777.4163x21044,Sri Lanka
Michael Lee,"7613 Hendricks Ports Apt. 032East Jonathanmouth, WI 28989",courtney13@example.com,Stand week listen language majority common commercial. Church enter have himself.,+1-850-205-0970,United Arab Emirates
Lauren Wright,"7962 Lucas Lodge Apt. 787Carrollchester, IL 11235",fischerderek@example.org,Pretty become try mouth wish similar partner.Down health least really least loss director share. President notice whose. Break fish many on. Bank necessary better how.,001-784-488-3848,Taiwan
Terry Simpson,"03445 Amber BranchWest Petershire, LA 98814",kellychapman@example.com,Animal international agreement gun charge. Model charge work participant join third page.Hard skin practice minute throughout yet. Coach minute heavy wish indicate mind money hit.,635.941.4092x7917,Algeria
Colleen Wells,Unit 5440 Box 1067DPO AP 01305,qphillips@example.com,Camera series score modern up begin should pass. Certain enough nation billion always condition owner. Under drive base with success.,487.925.2105,Martinique
John Stanton,"69254 Stanley GlensTammyfort, MA 81399",dmaxwell@example.net,Science court reveal player. About quality health sell leave car gun worker. Trip table network down research eat action.Organization Congress goal firm treatment continue interesting.,2438474788,Bermuda
Zachary Hanna,"PSC 4411, Box 3202APO AE 44146",carlacarroll@example.com,Hundred blood street nor modern thus. Too difficult cell happen effect state. One although player bag.Respond face international attorney everybody.,(789)742-6717x404,Sri Lanka
Mr. David Bailey,"68767 Jacqueline ForgeEast Shannonmouth, NY 23487",sheilabrown@example.net,Standard add party myself entire. Sense allow Congress soldier make lose nature still. Program bill cell style job perhaps.,(231)790-2894x354,Isle of Man
Jeffrey Mcintosh,"665 Christopher Stream Suite 386New Josephmouth, NY 06778",ryan99@example.com,Present long various may. Relationship miss heavy outside. Service court event just. Tend body base however foot treatment law city.Six read only system eight turn.,222-943-7101,United States of America
Nicole Wagner MD,"1743 Stephanie Loaf Suite 733New Maryberg, OK 98069",scott59@example.net,Agreement try response national current accept. Consumer door necessary million section. Prevent recent wrong leave.Name budget easy. Kid entire deep trial career money successful.,(272)432-1089x78150,Cocos (Keeling) Islands
Amy Hicks,"5121 King Walks Suite 780Watsonbury, SD 67244",bwagner@example.net,Simply gun successful degree new remain. Tv write business prepare pick article last ball.Treat both firm process contain right bad. Build enjoy remember politics heavy candidate others mean.,742-882-2150,Palestinian Territory
Kevin Anderson,USNV BarnesFPO AP 64994,qmartinez@example.com,Tv prepare fill. Remember store lose science experience.Trouble Congress stay everybody do may order.,498.404.7309x7042,Finland
Dean Sanders,"980 Miller Parkway Apt. 889East Jessicaburgh, ME 67589",jamie36@example.net,Beautiful yeah fast majority. Clear add court.Friend space understand environment. Material future structure president. Camera might blood call vote decision.,427-582-3186x0626,Tuvalu
Samuel Payne,"9177 Charles Stravenue Suite 542West Chad, MH 73522",deborahaustin@example.net,Order letter production blood. Sit as actually election sell.Wish you modern nor company respond. Human behind civil grow discussion.,708.580.5489x05552,Mexico
Debra Cherry,"4352 Sandra Forks Apt. 803West Richardfurt, MS 47881",unguyen@example.org,Stay strong bed relate war. Only blue rather national family. Level bad instead challenge seat high message.Article be to sound series then. Night with on community picture.,517-504-7850,Pitcairn Islands
Christina Collins,Unit 1367 Box 7896DPO AE 85684,jill77@example.com,Analysis plant bag. Safe audience relate accept good gun teacher. Around stuff level hit seven account year nature. Pretty chair maintain author movement.Him opportunity morning challenge cell help.,4976564694,Haiti
Michele Rogers,"03504 Sanchez Field Apt. 402Port Cindyborough, VI 45880",jensenmelissa@example.net,Live do next present against professor. Business eight since popular.Short suggest in weight former. Shoulder nothing front prevent where.,310-882-1473x7384,French Guiana
Jennifer Lang,"51755 Goodman HarborsWest Lindsey, ME 08416",charles11@example.com,Serve teacher professor medical. Result message require rich market apply. Fact radio point your time.,+1-402-837-7155,Macao
Sandra Young,Unit 7107 Box 5852DPO AE 22179,ronald25@example.net,Market price build outside not. Lawyer future since represent its agree agree.Skill responsibility staff cut local. Learn contain open listen next agree.To eat tax.,634.430.8260x26083,Seychelles
Daniel Grant,USNS OrtizFPO AE 10139,jimnoble@example.com,Forget hospital quickly whether break girl. More middle already probably standard morning community.Small national relate. Easy speech see many why. Best friend lose end.,237-271-7795x39234,Honduras
Laura Holt,"77466 Dean Isle Apt. 207Traceymouth, WV 48804",michael71@example.com,Medical town wait pass church career. Their avoid reduce peace chance enter. Spend base animal with reach.,+1-350-807-1271x91551,Bhutan
Angela Waters,"25608 Carroll HavenJonesview, UT 02992",lpratt@example.com,Industry southern condition change art. Compare past full interview.Great close situation finish impact magazine. Air evening lead situation start serve manage direction.,546-628-1867x66783,Oman
Daniel Walker,"0298 Andrew RowNew Micheleview, FM 84110",walshlee@example.net,Black admit phone discover position attention which. Light audience record pass so employee. Foot without world response itself everyone.,(469)362-0585x842,Guatemala
Rachel Bradley,"4095 April CrossingJulietown, VT 94575",craigkathleen@example.com,Final hot different green news. Suddenly son cover free example itself blood system. Us artist meeting also heavy their.,626-322-1697,Jersey
Joshua Ferguson,"33968 Lucas ValleyNew Stephanie, MI 79709",macdonaldstephanie@example.net,Politics lose strategy team nice. Person design mission she cultural tell.Pass onto bad audience. Look Mr probably amount shoulder order run. While structure worker carry firm upon.,916-345-7166x937,Iceland
Dylan Thompson,"30893 Sara MountainLake Leslie, MI 25968",conraddiane@example.net,Everyone ready section. True window through sure.Author camera yourself tax. Coach message fast medical open box we. Town attack level then simply for.,754-773-9816x2236,Lebanon
Michael Flores,"70952 Tucker RanchNorth Thomasstad, KY 09679",christopherlee@example.com,Situation father share agent act tough candidate return. Individual little draw a whether five.Increase prevent treat view. Much market memory return.,278-730-6132,Cocos (Keeling) Islands
Kevin Cherry,"873 Michele GardensKarlberg, PW 83295",josephsmith@example.net,Enter guess end option sport arrive. Its natural relate service prepare increase bill. Vote agency answer size month stay eat another.State his serious quality maybe course pick.,824.327.6950,Algeria
Jody Reyes,"17545 Lyons SpursRandyville, UT 88211",woodwardnatasha@example.org,Accept election rather pressure subject magazine discuss buy. No sport seat human else able.Detail respond she. Time result nature a way. Message become box book.,455-555-8255,Libyan Arab Jamahiriya
Ronald Ballard,"3138 Taylor Brook Apt. 889Brandimouth, MS 26046",johnsonmatthew@example.com,Either marriage they many south several. Provide short similar.Environment particular nice upon middle. Everybody brother state street purpose song. Forget wear tonight often fall even approach.,001-317-598-4926x79418,Moldova
Vincent Chavez,Unit 9397 Box 1485DPO AP 19331,hsanchez@example.org,Explain reason throw the attorney. Note model yes. Five ok piece bar parent grow.Forward light red would young. Share everyone price nice choice either notice six.,(527)451-8390,Sri Lanka
Courtney Kirk,"0902 Virginia Fords Apt. 822Oneillshire, MP 27296",crystalalexander@example.net,Organization fast how tough sign this important.Report task then too young network. Most public next chair east little notice. Recently pattern require those fire audience.,(922)462-8271x609,North Macedonia
Jennifer Carpenter,Unit 2950 Box 7544DPO AE 03955,pcox@example.org,Development prevent safe same I trial plan. Everyone speak window base long when.Research second ever threat. Reach front experience series.,001-911-727-4727x108,Panama
Patrick Hines,"52007 Mccoy Terrace Suite 955West Kayla, IL 93012",lori81@example.net,Hit home inside relationship appear including. Lead take agency.Would may these because doctor serve. Amount various customer many including protect us.,9312430954,Uzbekistan
Gina Nunez,"8441 Joel Mission Apt. 569Lake Seanville, ID 31301",palmeranita@example.org,Country Republican car season process modern. Too hit deal air us.More show offer lay certainly majority heavy evening. Wide seat per town go. Boy find Congress want other reduce.,(475)586-0476,Guinea
Gregory Ferguson,"888 James Course Suite 447Evansshire, FL 56364",kimberly43@example.net,Trial perhaps once thing. Process success hold this customer firm popular.,001-560-260-0406,Peru
Terry Obrien,USCGC LindseyFPO AA 16464,jasonreynolds@example.com,Past manage stuff minute skin. Human along finish city left song see green.,2063284581,Papua New Guinea
Cesar Johnson MD,"27134 Regina ViewTravisbury, MN 37569",jesus47@example.net,Tough within through professor mind. Sport I stand growth theory throughout.Fill school church raise. Common staff coach expert arm important center rule.,293-349-0839x779,Yemen
Matthew Brown,"991 Michael Rest Apt. 789Lake Aaronton, AK 11756",catherinemiller@example.com,Take tend thought. Back window foot half turn end.Too stuff decade someone move read. Poor become painting see. Prepare central wish education.Which year cold end. Key next shake fear who.,+1-347-538-8899x082,Rwanda
